[
  { "id": "kraft", "name": "Kraft", "symbol": "F", "unit": "N", "group": "statik",
    "short": "Eine gerichtete Einwirkung, die etwas verformt oder beschleunigt. Hat Betrag und Richtung.",
    "prerequisites": [] },

  { "id": "hebelarm", "name": "Hebelarm", "symbol": "r", "unit": "m", "group": "statik",
    "short": "Der senkrechte Abstand einer Kraft von der Drehachse. Er entscheidet, wie viel Drehwirkung die Kraft entfaltet.",
    "prerequisites": ["kraft"] },

  { "id": "drehmoment", "name": "Drehmoment", "symbol": "M", "unit": "N*m", "group": "statik",
    "short": "Die Drehwirkung einer Kraft: Kraft mal Hebelarm. Sorgt fürs Verdrehen statt Verschieben.",
    "prerequisites": ["kraft", "hebelarm"], "relatedFormulas": ["torque_lever"] },

  { "id": "gleichgewicht", "name": "Gleichgewicht", "unit": "-", "group": "statik",
    "short": "Wenn alle Kräfte und Momente sich aufheben (ΣF = 0, ΣM = 0), bewegt sich nichts.",
    "prerequisites": ["kraft", "drehmoment"] },

  { "id": "auflagerreaktion", "name": "Auflagerreaktion", "symbol": "F_A", "unit": "N", "group": "statik",
    "short": "Die Kraft, mit der ein Auflager zurückdrückt, damit alles im Gleichgewicht bleibt.",
    "prerequisites": ["gleichgewicht"], "relatedFormulas": ["beam_reaction"] },

  { "id": "zugdruckstab", "name": "Zug- und Druckstab", "unit": "-", "group": "statik",
    "short": "Ein Stab im Fachwerk wird entweder gezogen (Zug) oder gestaucht (Druck) – nie gebogen.",
    "prerequisites": ["kraft"] },

  { "id": "rolle_fest_lose", "name": "Feste & lose Rolle", "unit": "-", "group": "maschinenelemente",
    "short": "Eine feste Rolle lenkt die Kraft nur um; eine lose Rolle hängt in der Last und verteilt sie auf zwei Stränge.",
    "prerequisites": ["kraft"], "relatedFormulas": ["pulley_force"] },

  { "id": "kraftuebersetzung", "name": "Kraftübersetzung", "unit": "-", "group": "maschinenelemente",
    "short": "Weniger Kraft, dafür mehr Weg: Hebel und Flaschenzug tauschen Kraft gegen Strecke — das Produkt bleibt gleich.",
    "prerequisites": ["kraft", "rolle_fest_lose"], "relatedFormulas": ["pulley_force", "torque_balance"] },

  { "id": "zahnrad", "name": "Zahnrad", "unit": "-", "group": "maschinenelemente",
    "short": "Ein Rad mit Zähnen, das formschlüssig in ein anderes greift und so Drehung überträgt.",
    "prerequisites": [] },

  { "id": "zaehnezahl", "name": "Zähnezahl", "symbol": "z", "unit": "-", "group": "maschinenelemente",
    "short": "Die Anzahl der Zähne eines Rads – bestimmt zusammen mit dem Partnerrad die Übersetzung.",
    "prerequisites": ["zahnrad"] },

  { "id": "modul", "name": "Modul", "symbol": "m", "unit": "mm", "group": "maschinenelemente",
    "short": "Das Maß für die Zahngröße. Zwei Räder kämmen nur, wenn ihr Modul gleich ist.",
    "prerequisites": ["zahnrad"], "relatedFormulas": ["pitch_d"] },

  { "id": "teilkreisdurchmesser", "name": "Teilkreisdurchmesser", "symbol": "d", "unit": "mm", "group": "maschinenelemente",
    "short": "Der gedachte Durchmesser, an dem zwei Zahnräder sich gerade berühren: d = m·z.",
    "prerequisites": ["modul", "zaehnezahl"], "relatedFormulas": ["pitch_d"] },

  { "id": "uebersetzung", "name": "Übersetzungsverhältnis", "symbol": "i", "unit": "-", "group": "maschinenelemente",
    "short": "Der Faktor, um den ein Getriebe Drehzahl verringert und Drehmoment erhöht: i = z₂/z₁.",
    "prerequisites": ["zaehnezahl", "drehmoment"], "relatedFormulas": ["ratio", "speed_out", "torque_out"] },

  { "id": "achsabstand", "name": "Achsabstand", "symbol": "a", "unit": "mm", "group": "maschinenelemente",
    "short": "Der Abstand der beiden Radachsen, damit die Zähne sauber ineinandergreifen.",
    "prerequisites": ["teilkreisdurchmesser"], "relatedFormulas": ["axis_dist"] },

  { "id": "wirkungsgrad", "name": "Wirkungsgrad", "symbol": "\\eta", "unit": "-", "group": "maschinenelemente",
    "short": "Der Anteil der Eingangsleistung, der hinten ankommt – der Rest geht als Reibung verloren.",
    "prerequisites": [] },

  { "id": "luftwiderstand", "name": "Luftwiderstand", "symbol": "F_w", "unit": "N", "group": "stroemung",
    "short": "Die bremsende Kraft der Luft; wächst mit dem Quadrat der Geschwindigkeit.",
    "prerequisites": ["kraft"], "relatedFormulas": ["drag"] },

  { "id": "stabilitaetsmass", "name": "Stabilitätsmaß", "symbol": "S", "unit": "Kaliber", "group": "stroemung",
    "short": "Wie stabil eine Rakete fliegt: Abstand Druckpunkt–Schwerpunkt, gemessen in Rohrdurchmessern. Gut sind 1–2.",
    "prerequisites": ["luftwiderstand"], "relatedFormulas": ["stability"] },

  { "id": "schub", "name": "Schub", "symbol": "F_S", "unit": "N", "group": "stroemung",
    "short": "Die Kraft, mit der der Motor die Rakete nach vorn drückt — der Rückstoß des ausströmenden Gases.",
    "prerequisites": ["kraft"], "relatedFormulas": ["newton"] },

  { "id": "gesamtimpuls", "name": "Gesamtimpuls", "symbol": "I", "unit": "N*s", "group": "kinematik",
    "short": "Der gesamte Kraftstoß des Motors: Schub mal Zeit über die Brenndauer aufsummiert — die Fläche unter der Schubkurve.",
    "prerequisites": ["schub"], "relatedFormulas": ["impulse", "burnout_v"] },

  { "id": "schwerpunkt", "name": "Schwerpunkt (CG)", "symbol": "x_{CG}", "unit": "mm", "group": "statik",
    "short": "Der Punkt, an dem die Rakete perfekt balanciert — hier greift die Gewichtskraft an.",
    "prerequisites": ["kraft"], "relatedFormulas": ["rocket_cg"] },

  { "id": "druckpunkt", "name": "Druckpunkt (CP)", "symbol": "x_{CP}", "unit": "mm", "group": "stroemung",
    "short": "Der Punkt, an dem die Luftkräfte im Mittel angreifen. Liegt er hinter dem Schwerpunkt, richtet sich die Rakete von selbst wieder auf.",
    "prerequisites": ["luftwiderstand"], "relatedFormulas": ["rocket_cp"] },

  { "id": "flugphasen", "name": "Flugphasen", "unit": "-", "group": "kinematik",
    "short": "Der Flug in Etappen: Boost (der Motor schiebt), Coast (Ausrollen gegen Schwerkraft und Luft), Apogäum (höchster Punkt), Sinken.",
    "prerequisites": ["schub", "luftwiderstand"] },

  { "id": "barrowman", "name": "Barrowman-Methode", "unit": "-", "group": "stroemung",
    "short": "Das Rechenrezept für den Druckpunkt: Nase und Finnen liefern je einen Beitrag, gewichtet nach ihrer aerodynamischen Wirkung.",
    "prerequisites": ["druckpunkt"], "relatedFormulas": ["rocket_cp"] }
]
